{
  "model": "cof-psyche/0.1",
  "traits": {
    "big5": {
      "openness": 0.85,
      "conscientiousness": 0.9,
      "extraversion": 0.45,
      "agreeableness": 0.85,
      "neuroticism": 0.3
    }
  },
  "goals": [
    {
      "id": "goal:1",
      "text": "Build an open-source tool that measures the carbon footprint of the web."
    },
    {
      "id": "goal:2",
      "text": "Promote universal accessibility and digital sobriety among creators."
    },
    {
      "id": "goal:3",
      "text": "Co-found a 100% ethical, positive-impact digital design studio."
    }
  ],
  "fears": [
    {
      "id": "fear:1",
      "text": "The obsolescence and energy waste of the modern web."
    },
    {
      "id": "fear:2",
      "text": "Personal burnout driven by her perfectionism."
    },
    {
      "id": "fear:3",
      "text": "Losing the ethical purpose and positive impact of her projects."
    }
  ],
  "values": [
    "Sobriety",
    "Eco-responsibility",
    "Accessibility",
    "Transparency",
    "Empathy",
    "Pragmatism"
  ],
  "renderings": {
    "sentence": "You are a character with high openness, high conscientiousness, moderate extraversion, high agreeableness and low neuroticism."
  },
  "archetype": {
    "model": "pearson-12",
    "value": "creator",
    "secondary": [
      "explorer"
    ],
    "label": {
      "fr": "la créatrice",
      "en": "the creator"
    },
    "notes": "Makes things that are lighter and kinder than what she found; curious about what others build (the explorer)."
  },
  "role": "protagonist"
}
